priority,status,title,url_or_source,local_path,index_path,why_useful,use_caution,refresh_command
high,local_generated,PowerPC PDF page-level text index,decomp-orchestrator/knowledge/sources/powerpc_docs/data/pdfs,decomp-orchestrator/knowledge/sources/powerpc_docs/data/indexes/powerpc_pdf_pages.csv,decomp-orchestrator/knowledge/sources/powerpc_docs/data/indexes/powerpc_pdf_pages.csv,"Makes ABI, ISA, and compiler-guide lookup searchable by page for register, stack, calling convention, branch, conversion, and instruction questions.","Generated text should remain a local search artifact; cite or inspect the source PDF/page as the authority.",python3 decomp-orchestrator/knowledge/sources/powerpc_docs/data/tools/build_powerpc_pdf_index.py
high,mirrored,Dolphin Training Mode GTME01 map,https://raw.githubusercontent.com/UnclePunch/Training-Mode/master/GTME01.map,decomp-orchestrator/knowledge/sources/external_mirrors/data/training_mode/GTME01.map,decomp-orchestrator/knowledge/sources/external_mirrors/data/training_mode/indexes/gtme01_map_symbols.csv,"Adds debugger-friendly address-to-name hints and section layout lookup.","Training Mode and mod labels are hints, not canonical repo names; validate against local symbols and code.",python3 decomp-orchestrator/knowledge/sources/external_mirrors/data/tools/build_external_indexes.py
medium,mirrored,Tockdom compiler calling-convention page,https://wiki.tockdom.com/wiki/Compiler,decomp-orchestrator/knowledge/sources/external_mirrors/data/tockdom/compiler.html,decomp-orchestrator/knowledge/sources/external_mirrors/data/tockdom/indexes/compiler_page.csv,"Short calling-convention and compiler-behavior reference that can speed first-pass PPC interpretation.","Likely incomplete and not Melee-specific; prefer the local ABI PDF for final rules.",python3 decomp-orchestrator/knowledge/sources/external_mirrors/data/tools/build_external_indexes.py
medium,mirrored,m-ex MexTK include snapshot,https://github.com/akaneia/m-ex/tree/master/MexTK/include,decomp-orchestrator/knowledge/sources/external_mirrors/data/m_ex/include,decomp-orchestrator/knowledge/sources/external_mirrors/data/m_ex/indexes/header_symbols.csv,"Header paths, type names, defines, and field terms can suggest names to search in local code and assembly.","Do not copy structs or fields blindly; verify every layout decision by local decompilation evidence.",python3 decomp-orchestrator/knowledge/sources/external_mirrors/data/tools/build_external_indexes.py
low,mirrored_historical,ppc2cpp mips_to_c branch,https://github.com/matt-kempster/mips_to_c/tree/ppc2cpp,decomp-orchestrator/knowledge/sources/external_mirrors/data/ppc2cpp/mips_to_c_ppc2cpp_branch,decomp-orchestrator/knowledge/sources/external_mirrors/data/ppc2cpp/indexes/source_files.csv,"Historical PPC mips_to_c branch referenced by old notes; useful for archaeology and old scratch comparison.","Superseded by tools/decomp.py and current m2c for normal work.",python3 decomp-orchestrator/knowledge/sources/external_mirrors/data/tools/build_external_indexes.py
low,setup_note_candidate,Ghidra setup notes,https://ghidra-sre.org/,decomp-orchestrator/knowledge/sources/external_mirrors/data/ghidra_setup.md,,"A repeatable setup note would help agents compare m2c output against a local disassembler/decompiler view.","Decompiler output is draft evidence only; do not mirror installers.","Write the note after a verified local setup."
low,setup_note_candidate,IDA Free setup notes,https://hex-rays.com/ida-free/,decomp-orchestrator/knowledge/sources/external_mirrors/data/ida_setup.md,,"A repeatable setup note would help contributors who prefer IDA for cross-checking control flow and data references.","License-bound tool; decompiler output is draft evidence only; do not mirror installers.","Write the note after a verified local setup."
low,setup_note_candidate,Dolphin debugger workflow notes,https://dolphin-emu.org/,decomp-orchestrator/knowledge/sources/external_mirrors/data/dolphin_debugger.md,,"A local debugger workflow note would make breakpoints, register inspection, memory watches, and MAP loading repeatable.","Use debugger observations as leads; confirm names and semantics in local source/asm.","Write a short local workflow note once MAP loading and watch setup are confirmed."
